{
  "apiVersion": "dw.superapps/power-binding/v1",
  "packageManifestSha256": "1ad2d46b86027d1920ebdd26995c13ef83e6c79ac6d3713b0b0eaa3dfef2455a",
  "packageVersion": "gwc-main-1-76644885f4b25cb49a2a34bfea0e2ede941caa01",
  "powerId": "gwc",
  "runtimePath": "/Users/mac/prj/DW-SuperApps/.kilo/worktrees/boiterplate/projects/rental-home/.gwc",
  "storePath": "/Users/mac/prj/DW-SuperApps/.kilo/worktrees/boiterplate/.dw/powers/gwc",
  "systemId": "rental-home",
  "targetPath": "/Users/mac/prj/DW-SuperApps/.kilo/worktrees/boiterplate/projects/rental-home",
  "updatedAtEpoch": 1785068618
}
